No.     Time           Source                Destination           Protocol Length Info
 509160 232.649717     192.168.0.7           66.33.22.59           TCP      78     49342 → 443 [SYN, ECE, CWR] Seq=0 Win=65535 Len=0 MSS=1460 WS=64 TSval=3138174778 TSecr=0 SACK_PERM

Frame 509160: 78 bytes on wire (624 bits), 78 bytes captured (624 bits) on interface en0, id 0
    Section number: 1
    Interface id: 0 (en0)
        Interface name: en0
        Interface description: Wi-Fi
    Encapsulation type: Ethernet (1)
    Arrival Time: Sep 21, 2025 13:31:21.425116000 CST
    UTC Arrival Time: Sep 21, 2025 19:31:21.425116000 UTC
    Epoch Arrival Time: 1758483081.425116000
    [Time shift for this packet: 0.000000000 seconds]
    [Time delta from previous captured frame: 0.001018000 seconds]
    [Time delta from previous displayed frame: 0.000000000 seconds]
    [Time since reference or first frame: 232.649717000 seconds]
    Frame Number: 509160
    Frame Length: 78 bytes (624 bits)
    Capture Length: 78 bytes (624 bits)
    [Frame is marked: False]
    [Frame is ignored: False]
    [Protocols in frame: eth:ethertype:ip:tcp]
    [Coloring Rule Name: TCP SYN/FIN]
    [Coloring Rule String: tcp.flags & 0x02 || tcp.flags.fin == 1]
Ethernet II, Src: 06:34:e6:94:64:f2 (06:34:e6:94:64:f2), Dst: Commscope_eb:d5:16 (c0:89:ab:eb:d5:16)
    Destination: Commscope_eb:d5:16 (c0:89:ab:eb:d5:16)
        .... ..0. .... .... .... .... = LG bit: Globally unique address (factory default)
        .... ...0 .... .... .... .... = IG bit: Individual address (unicast)
    Source: 06:34:e6:94:64:f2 (06:34:e6:94:64:f2)
        .... ..1. .... .... .... .... = LG bit: Locally administered address (this is NOT the factory default)
        .... ...0 .... .... .... .... = IG bit: Individual address (unicast)
    Type: IPv4 (0x0800)
    [Stream index: 0]
Internet Protocol Version 4, Src: 192.168.0.7, Dst: 66.33.22.59
    0100 .... = Version: 4
    .... 0101 = Header Length: 20 bytes (5)
    Differentiated Services Field: 0x00 (DSCP: CS0, ECN: Not-ECT)
        0000 00.. = Differentiated Services Codepoint: Default (0)
        .... ..00 = Explicit Congestion Notification: Not ECN-Capable Transport (0)
    Total Length: 64
    Identification: 0x0000 (0)
    010. .... = Flags: 0x2, Don't fragment
        0... .... = Reserved bit: Not set
        .1.. .... = Don't fragment: Set
        ..0. .... = More fragments: Not set
    ...0 0000 0000 0000 = Fragment Offset: 0
    Time to Live: 64
    Protocol: TCP (6)
    Header Checksum: 0x21ad [validation disabled]
    [Header checksum status: Unverified]
    Source Address: 192.168.0.7
    Destination Address: 66.33.22.59
    [Stream index: 86]
Transmission Control Protocol, Src Port: 49342, Dst Port: 443, Seq: 0, Len: 0
    Source Port: 49342
    Destination Port: 443
    [Stream index: 206]
    [Stream Packet Number: 1]
    [Conversation completeness: Complete, WITH_DATA (63)]
        ..1. .... = RST: Present
        ...1 .... = FIN: Present
        .... 1... = Data: Present
        .... .1.. = ACK: Present
        .... ..1. = SYN-ACK: Present
        .... ...1 = SYN: Present
        [Completeness Flags: RFDASS]
    [TCP Segment Len: 0]
    Sequence Number: 0    (relative sequence number)
    Sequence Number (raw): 2446831734
    [Next Sequence Number: 1    (relative sequence number)]
    Acknowledgment Number: 0
    Acknowledgment number (raw): 0
    1011 .... = Header Length: 44 bytes (11)
    Flags: 0x0c2 (SYN, ECE, CWR)
        000. .... .... = Reserved: Not set
        ...0 .... .... = Accurate ECN: Not set
        .... 1... .... = Congestion Window Reduced: Set
        .... .1.. .... = ECN-Echo: Set
        .... ..0. .... = Urgent: Not set
        .... ...0 .... = Acknowledgment: Not set
        .... .... 0... = Push: Not set
        .... .... .0.. = Reset: Not set
        .... .... ..1. = Syn: Set
            [Expert Info (Chat/Sequence): Connection establish request (SYN): server port 443]
                [Connection establish request (SYN): server port 443]
                [Severity level: Chat]
                [Group: Sequence]
        .... .... ...0 = Fin: Not set
        [TCP Flags: ····CE····S·]
    Window: 65535
    [Calculated window size: 65535]
    Checksum: 0x9e21 [unverified]
    [Checksum Status: Unverified]
    Urgent Pointer: 0
    Options: (24 bytes), Maximum segment size, No-Operation (NOP), Window scale, No-Operation (NOP), No-Operation (NOP), Timestamps, SACK permitted, End of Option List (EOL), End of Option List (EOL)
        TCP Option - Maximum segment size: 1460 bytes
            Kind: Maximum Segment Size (2)
            Length: 4
            MSS Value: 1460
        TCP Option - No-Operation (NOP)
            Kind: No-Operation (1)
        TCP Option - Window scale: 6 (multiply by 64)
            Kind: Window Scale (3)
            Length: 3
            Shift count: 6
            [Multiplier: 64]
        TCP Option - No-Operation (NOP)
            Kind: No-Operation (1)
        TCP Option - No-Operation (NOP)
            Kind: No-Operation (1)
        TCP Option - Timestamps: TSval 3138174778, TSecr 0
            Kind: Time Stamp Option (8)
            Length: 10
            Timestamp value: 3138174778
            Timestamp echo reply: 0
        TCP Option - SACK permitted
            Kind: SACK Permitted (4)
            Length: 2
        TCP Option - End of Option List (EOL)
            Kind: End of Option List (0)
        TCP Option - End of Option List (EOL)
            Kind: End of Option List (0)
    [Timestamps]
        [Time since first frame in this TCP stream: 0.000000000 seconds]
        [Time since previous frame in this TCP stream: 0.000000000 seconds]

No.     Time           Source                Destination           Protocol Length Info
 509393 232.723293     66.33.22.59           192.168.0.7           TCP      74     443 → 49342 [SYN, ACK, ECE] Seq=0 Ack=1 Win=65160 Len=0 MSS=1440 SACK_PERM TSval=1836343114 TSecr=3138174778 WS=128

Frame 509393: 74 bytes on wire (592 bits), 74 bytes captured (592 bits) on interface en0, id 0
    Section number: 1
    Interface id: 0 (en0)
        Interface name: en0
        Interface description: Wi-Fi
    Encapsulation type: Ethernet (1)
    Arrival Time: Sep 21, 2025 13:31:21.498692000 CST
    UTC Arrival Time: Sep 21, 2025 19:31:21.498692000 UTC
    Epoch Arrival Time: 1758483081.498692000
    [Time shift for this packet: 0.000000000 seconds]
    [Time delta from previous captured frame: 0.001774000 seconds]
    [Time delta from previous displayed frame: 0.073576000 seconds]
    [Time since reference or first frame: 232.723293000 seconds]
    Frame Number: 509393
    Frame Length: 74 bytes (592 bits)
    Capture Length: 74 bytes (592 bits)
    [Frame is marked: False]
    [Frame is ignored: False]
    [Protocols in frame: eth:ethertype:ip:tcp]
    [Coloring Rule Name: TCP SYN/FIN]
    [Coloring Rule String: tcp.flags & 0x02 || tcp.flags.fin == 1]
Ethernet II, Src: Commscope_eb:d5:16 (c0:89:ab:eb:d5:16), Dst: 06:34:e6:94:64:f2 (06:34:e6:94:64:f2)
    Destination: 06:34:e6:94:64:f2 (06:34:e6:94:64:f2)
        .... ..1. .... .... .... .... = LG bit: Locally administered address (this is NOT the factory default)
        .... ...0 .... .... .... .... = IG bit: Individual address (unicast)
    Source: Commscope_eb:d5:16 (c0:89:ab:eb:d5:16)
        .... ..0. .... .... .... .... = LG bit: Globally unique address (factory default)
        .... ...0 .... .... .... .... = IG bit: Individual address (unicast)
    Type: IPv4 (0x0800)
    [Stream index: 0]
Internet Protocol Version 4, Src: 66.33.22.59, Dst: 192.168.0.7
    0100 .... = Version: 4
    .... 0101 = Header Length: 20 bytes (5)
    Differentiated Services Field: 0x00 (DSCP: CS0, ECN: Not-ECT)
        0000 00.. = Differentiated Services Codepoint: Default (0)
        .... ..00 = Explicit Congestion Notification: Not ECN-Capable Transport (0)
    Total Length: 60
    Identification: 0x0000 (0)
    010. .... = Flags: 0x2, Don't fragment
        0... .... = Reserved bit: Not set
        .1.. .... = Don't fragment: Set
        ..0. .... = More fragments: Not set
    ...0 0000 0000 0000 = Fragment Offset: 0
    Time to Live: 45
    Protocol: TCP (6)
    Header Checksum: 0x34b1 [validation disabled]
    [Header checksum status: Unverified]
    Source Address: 66.33.22.59
    Destination Address: 192.168.0.7
    [Stream index: 86]
Transmission Control Protocol, Src Port: 443, Dst Port: 49342, Seq: 0, Ack: 1, Len: 0
    Source Port: 443
    Destination Port: 49342
    [Stream index: 206]
    [Stream Packet Number: 2]
    [Conversation completeness: Complete, WITH_DATA (63)]
        ..1. .... = RST: Present
        ...1 .... = FIN: Present
        .... 1... = Data: Present
        .... .1.. = ACK: Present
        .... ..1. = SYN-ACK: Present
        .... ...1 = SYN: Present
        [Completeness Flags: RFDASS]
    [TCP Segment Len: 0]
    Sequence Number: 0    (relative sequence number)
    Sequence Number (raw): 876870661
    [Next Sequence Number: 1    (relative sequence number)]
    Acknowledgment Number: 1    (relative ack number)
    Acknowledgment number (raw): 2446831735
    1010 .... = Header Length: 40 bytes (10)
    Flags: 0x052 (SYN, ACK, ECE)
        000. .... .... = Reserved: Not set
        ...0 .... .... = Accurate ECN: Not set
        .... 0... .... = Congestion Window Reduced: Not set
        .... .1.. .... = ECN-Echo: Set
        .... ..0. .... = Urgent: Not set
        .... ...1 .... = Acknowledgment: Set
        .... .... 0... = Push: Not set
        .... .... .0.. = Reset: Not set
        .... .... ..1. = Syn: Set
            [Expert Info (Chat/Sequence): Connection establish acknowledge (SYN+ACK): server port 443]
                [Connection establish acknowledge (SYN+ACK): server port 443]
                [Severity level: Chat]
                [Group: Sequence]
        .... .... ...0 = Fin: Not set
        [TCP Flags: ·····E·A··S·]
    Window: 65160
    [Calculated window size: 65160]
    Checksum: 0xb417 [unverified]
    [Checksum Status: Unverified]
    Urgent Pointer: 0
    Options: (20 bytes), Maximum segment size, SACK permitted, Timestamps, No-Operation (NOP), Window scale
        TCP Option - Maximum segment size: 1440 bytes
            Kind: Maximum Segment Size (2)
            Length: 4
            MSS Value: 1440
        TCP Option - SACK permitted
            Kind: SACK Permitted (4)
            Length: 2
        TCP Option - Timestamps: TSval 1836343114, TSecr 3138174778
            Kind: Time Stamp Option (8)
            Length: 10
            Timestamp value: 1836343114
            Timestamp echo reply: 3138174778
        TCP Option - No-Operation (NOP)
            Kind: No-Operation (1)
        TCP Option - Window scale: 7 (multiply by 128)
            Kind: Window Scale (3)
            Length: 3
            Shift count: 7
            [Multiplier: 128]
    [Timestamps]
        [Time since first frame in this TCP stream: 0.073576000 seconds]
        [Time since previous frame in this TCP stream: 0.073576000 seconds]
    [SEQ/ACK analysis]
        [This is an ACK to the segment in frame: 509160]
        [The RTT to ACK the segment was: 0.073576000 seconds]
        [iRTT: 0.073720000 seconds]

No.     Time           Source                Destination           Protocol Length Info
 509394 232.723437     192.168.0.7           66.33.22.59           TCP      66     49342 → 443 [ACK] Seq=1 Ack=1 Win=131392 Len=0 TSval=3138174851 TSecr=1836343114

Frame 509394: 66 bytes on wire (528 bits), 66 bytes captured (528 bits) on interface en0, id 0
    Section number: 1
    Interface id: 0 (en0)
        Interface name: en0
        Interface description: Wi-Fi
    Encapsulation type: Ethernet (1)
    Arrival Time: Sep 21, 2025 13:31:21.498836000 CST
    UTC Arrival Time: Sep 21, 2025 19:31:21.498836000 UTC
    Epoch Arrival Time: 1758483081.498836000
    [Time shift for this packet: 0.000000000 seconds]
    [Time delta from previous captured frame: 0.000144000 seconds]
    [Time delta from previous displayed frame: 0.000144000 seconds]
    [Time since reference or first frame: 232.723437000 seconds]
    Frame Number: 509394
    Frame Length: 66 bytes (528 bits)
    Capture Length: 66 bytes (528 bits)
    [Frame is marked: False]
    [Frame is ignored: False]
    [Protocols in frame: eth:ethertype:ip:tcp]
    [Coloring Rule Name: TCP]
    [Coloring Rule String: tcp]
Ethernet II, Src: 06:34:e6:94:64:f2 (06:34:e6:94:64:f2), Dst: Commscope_eb:d5:16 (c0:89:ab:eb:d5:16)
    Destination: Commscope_eb:d5:16 (c0:89:ab:eb:d5:16)
        .... ..0. .... .... .... .... = LG bit: Globally unique address (factory default)
        .... ...0 .... .... .... .... = IG bit: Individual address (unicast)
    Source: 06:34:e6:94:64:f2 (06:34:e6:94:64:f2)
        .... ..1. .... .... .... .... = LG bit: Locally administered address (this is NOT the factory default)
        .... ...0 .... .... .... .... = IG bit: Individual address (unicast)
    Type: IPv4 (0x0800)
    [Stream index: 0]
Internet Protocol Version 4, Src: 192.168.0.7, Dst: 66.33.22.59
    0100 .... = Version: 4
    .... 0101 = Header Length: 20 bytes (5)
    Differentiated Services Field: 0x00 (DSCP: CS0, ECN: Not-ECT)
        0000 00.. = Differentiated Services Codepoint: Default (0)
        .... ..00 = Explicit Congestion Notification: Not ECN-Capable Transport (0)
    Total Length: 52
    Identification: 0x0000 (0)
    010. .... = Flags: 0x2, Don't fragment
        0... .... = Reserved bit: Not set
        .1.. .... = Don't fragment: Set
        ..0. .... = More fragments: Not set
    ...0 0000 0000 0000 = Fragment Offset: 0
    Time to Live: 64
    Protocol: TCP (6)
    Header Checksum: 0x21b9 [validation disabled]
    [Header checksum status: Unverified]
    Source Address: 192.168.0.7
    Destination Address: 66.33.22.59
    [Stream index: 86]
Transmission Control Protocol, Src Port: 49342, Dst Port: 443, Seq: 1, Ack: 1, Len: 0
    Source Port: 49342
    Destination Port: 443
    [Stream index: 206]
    [Stream Packet Number: 3]
    [Conversation completeness: Complete, WITH_DATA (63)]
        ..1. .... = RST: Present
        ...1 .... = FIN: Present
        .... 1... = Data: Present
        .... .1.. = ACK: Present
        .... ..1. = SYN-ACK: Present
        .... ...1 = SYN: Present
        [Completeness Flags: RFDASS]
    [TCP Segment Len: 0]
    Sequence Number: 1    (relative sequence number)
    Sequence Number (raw): 2446831735
    [Next Sequence Number: 1    (relative sequence number)]
    Acknowledgment Number: 1    (relative ack number)
    Acknowledgment number (raw): 876870662
    1000 .... = Header Length: 32 bytes (8)
    Flags: 0x010 (ACK)
        000. .... .... = Reserved: Not set
        ...0 .... .... = Accurate ECN: Not set
        .... 0... .... = Congestion Window Reduced: Not set
        .... .0.. .... = ECN-Echo: Not set
        .... ..0. .... = Urgent: Not set
        .... ...1 .... = Acknowledgment: Set
        .... .... 0... = Push: Not set
        .... .... .0.. = Reset: Not set
        .... .... ..0. = Syn: Not set
        .... .... ...0 = Fin: Not set
        [TCP Flags: ·······A····]
    Window: 2053
    [Calculated window size: 131392]
    [Window size scaling factor: 64]
    Checksum: 0xd94a [unverified]
    [Checksum Status: Unverified]
    Urgent Pointer: 0
    Options: (12 bytes), No-Operation (NOP), No-Operation (NOP), Timestamps
        TCP Option - No-Operation (NOP)
            Kind: No-Operation (1)
        TCP Option - No-Operation (NOP)
            Kind: No-Operation (1)
        TCP Option - Timestamps: TSval 3138174851, TSecr 1836343114
            Kind: Time Stamp Option (8)
            Length: 10
            Timestamp value: 3138174851
            Timestamp echo reply: 1836343114
    [Timestamps]
        [Time since first frame in this TCP stream: 0.073720000 seconds]
        [Time since previous frame in this TCP stream: 0.000144000 seconds]
    [SEQ/ACK analysis]
        [This is an ACK to the segment in frame: 509393]
        [The RTT to ACK the segment was: 0.000144000 seconds]
        [iRTT: 0.073720000 seconds]

No.     Time           Source                Destination           Protocol Length Info
 509396 232.729197     192.168.0.7           66.33.22.59           TCP      1494   49342 → 443 [ACK] Seq=1 Ack=1 Win=131392 Len=1428 TSval=3138174857 TSecr=1836343114 [TCP PDU reassembled in 509397]

Frame 509396: 1494 bytes on wire (11952 bits), 1494 bytes captured (11952 bits) on interface en0, id 0
    Section number: 1
    Interface id: 0 (en0)
        Interface name: en0
        Interface description: Wi-Fi
    Encapsulation type: Ethernet (1)
    Arrival Time: Sep 21, 2025 13:31:21.504596000 CST
    UTC Arrival Time: Sep 21, 2025 19:31:21.504596000 UTC
    Epoch Arrival Time: 1758483081.504596000
    [Time shift for this packet: 0.000000000 seconds]
    [Time delta from previous captured frame: 0.005730000 seconds]
    [Time delta from previous displayed frame: 0.005760000 seconds]
    [Time since reference or first frame: 232.729197000 seconds]
    Frame Number: 509396
    Frame Length: 1494 bytes (11952 bits)
    Capture Length: 1494 bytes (11952 bits)
    [Frame is marked: False]
    [Frame is ignored: False]
    [Protocols in frame: eth:ethertype:ip:tcp]
    [Coloring Rule Name: TCP]
    [Coloring Rule String: tcp]
Ethernet II, Src: 06:34:e6:94:64:f2 (06:34:e6:94:64:f2), Dst: Commscope_eb:d5:16 (c0:89:ab:eb:d5:16)
    Destination: Commscope_eb:d5:16 (c0:89:ab:eb:d5:16)
        .... ..0. .... .... .... .... = LG bit: Globally unique address (factory default)
        .... ...0 .... .... .... .... = IG bit: Individual address (unicast)
    Source: 06:34:e6:94:64:f2 (06:34:e6:94:64:f2)
        .... ..1. .... .... .... .... = LG bit: Locally administered address (this is NOT the factory default)
        .... ...0 .... .... .... .... = IG bit: Individual address (unicast)
    Type: IPv4 (0x0800)
    [Stream index: 0]
Internet Protocol Version 4, Src: 192.168.0.7, Dst: 66.33.22.59
    0100 .... = Version: 4
    .... 0101 = Header Length: 20 bytes (5)
    Differentiated Services Field: 0x02 (DSCP: CS0, ECN: ECT(0))
        0000 00.. = Differentiated Services Codepoint: Default (0)
        .... ..10 = Explicit Congestion Notification: ECN-Capable Transport codepoint '10' (2)
    Total Length: 1480
    Identification: 0x0000 (0)
    010. .... = Flags: 0x2, Don't fragment
        0... .... = Reserved bit: Not set
        .1.. .... = Don't fragment: Set
        ..0. .... = More fragments: Not set
    ...0 0000 0000 0000 = Fragment Offset: 0
    Time to Live: 64
    Protocol: TCP (6)
    Header Checksum: 0x1c23 [validation disabled]
    [Header checksum status: Unverified]
    Source Address: 192.168.0.7
    Destination Address: 66.33.22.59
    [Stream index: 86]
Transmission Control Protocol, Src Port: 49342, Dst Port: 443, Seq: 1, Ack: 1, Len: 1428
    Source Port: 49342
    Destination Port: 443
    [Stream index: 206]
    [Stream Packet Number: 4]
    [Conversation completeness: Complete, WITH_DATA (63)]
        ..1. .... = RST: Present
        ...1 .... = FIN: Present
        .... 1... = Data: Present
        .... .1.. = ACK: Present
        .... ..1. = SYN-ACK: Present
        .... ...1 = SYN: Present
        [Completeness Flags: RFDASS]
    [TCP Segment Len: 1428]
    Sequence Number: 1    (relative sequence number)
    Sequence Number (raw): 2446831735
    [Next Sequence Number: 1429    (relative sequence number)]
    Acknowledgment Number: 1    (relative ack number)
    Acknowledgment number (raw): 876870662
    1000 .... = Header Length: 32 bytes (8)
    Flags: 0x010 (ACK)
        000. .... .... = Reserved: Not set
        ...0 .... .... = Accurate ECN: Not set
        .... 0... .... = Congestion Window Reduced: Not set
        .... .0.. .... = ECN-Echo: Not set
        .... ..0. .... = Urgent: Not set
        .... ...1 .... = Acknowledgment: Set
        .... .... 0... = Push: Not set
        .... .... .0.. = Reset: Not set
        .... .... ..0. = Syn: Not set
        .... .... ...0 = Fin: Not set
        [TCP Flags: ·······A····]
    Window: 2053
    [Calculated window size: 131392]
    [Window size scaling factor: 64]
    Checksum: 0x0ad2 [unverified]
    [Checksum Status: Unverified]
    Urgent Pointer: 0
    Options: (12 bytes), No-Operation (NOP), No-Operation (NOP), Timestamps
        TCP Option - No-Operation (NOP)
            Kind: No-Operation (1)
        TCP Option - No-Operation (NOP)
            Kind: No-Operation (1)
        TCP Option - Timestamps: TSval 3138174857, TSecr 1836343114
            Kind: Time Stamp Option (8)
            Length: 10
            Timestamp value: 3138174857
            Timestamp echo reply: 1836343114
    [Timestamps]
        [Time since first frame in this TCP stream: 0.079480000 seconds]
        [Time since previous frame in this TCP stream: 0.005760000 seconds]
    [SEQ/ACK analysis]
        [iRTT: 0.073720000 seconds]
        [Bytes in flight: 1428]
        [Bytes sent since last PSH flag: 1428]
    TCP payload (1428 bytes)
    [Reassembled PDU in frame: 509397]
    TCP segment data (1428 bytes)

No.     Time           Source                Destination           Protocol Length Info
 509397 232.729221     192.168.0.7           66.33.22.59           TLSv1.3  205    Client Hello (SNI=git-mcp-server-production-a0cf.up.railway.app)

Frame 509397: 205 bytes on wire (1640 bits), 205 bytes captured (1640 bits) on interface en0, id 0
    Section number: 1
    Interface id: 0 (en0)
        Interface name: en0
        Interface description: Wi-Fi
    Encapsulation type: Ethernet (1)
    Arrival Time: Sep 21, 2025 13:31:21.504620000 CST
    UTC Arrival Time: Sep 21, 2025 19:31:21.504620000 UTC
    Epoch Arrival Time: 1758483081.504620000
    [Time shift for this packet: 0.000000000 seconds]
    [Time delta from previous captured frame: 0.000024000 seconds]
    [Time delta from previous displayed frame: 0.000024000 seconds]
    [Time since reference or first frame: 232.729221000 seconds]
    Frame Number: 509397
    Frame Length: 205 bytes (1640 bits)
    Capture Length: 205 bytes (1640 bits)
    [Frame is marked: False]
    [Frame is ignored: False]
    [Protocols in frame: eth:ethertype:ip:tcp:tls]
    [Coloring Rule Name: TCP]
    [Coloring Rule String: tcp]
Ethernet II, Src: 06:34:e6:94:64:f2 (06:34:e6:94:64:f2), Dst: Commscope_eb:d5:16 (c0:89:ab:eb:d5:16)
    Destination: Commscope_eb:d5:16 (c0:89:ab:eb:d5:16)
        .... ..0. .... .... .... .... = LG bit: Globally unique address (factory default)
        .... ...0 .... .... .... .... = IG bit: Individual address (unicast)
    Source: 06:34:e6:94:64:f2 (06:34:e6:94:64:f2)
        .... ..1. .... .... .... .... = LG bit: Locally administered address (this is NOT the factory default)
        .... ...0 .... .... .... .... = IG bit: Individual address (unicast)
    Type: IPv4 (0x0800)
    [Stream index: 0]
Internet Protocol Version 4, Src: 192.168.0.7, Dst: 66.33.22.59
    0100 .... = Version: 4
    .... 0101 = Header Length: 20 bytes (5)
    Differentiated Services Field: 0x02 (DSCP: CS0, ECN: ECT(0))
        0000 00.. = Differentiated Services Codepoint: Default (0)
        .... ..10 = Explicit Congestion Notification: ECN-Capable Transport codepoint '10' (2)
    Total Length: 191
    Identification: 0x0000 (0)
    010. .... = Flags: 0x2, Don't fragment
        0... .... = Reserved bit: Not set
        .1.. .... = Don't fragment: Set
        ..0. .... = More fragments: Not set
    ...0 0000 0000 0000 = Fragment Offset: 0
    Time to Live: 64
    Protocol: TCP (6)
    Header Checksum: 0x212c [validation disabled]
    [Header checksum status: Unverified]
    Source Address: 192.168.0.7
    Destination Address: 66.33.22.59
    [Stream index: 86]
Transmission Control Protocol, Src Port: 49342, Dst Port: 443, Seq: 1429, Ack: 1, Len: 139
    Source Port: 49342
    Destination Port: 443
    [Stream index: 206]
    [Stream Packet Number: 5]
    [Conversation completeness: Complete, WITH_DATA (63)]
        ..1. .... = RST: Present
        ...1 .... = FIN: Present
        .... 1... = Data: Present
        .... .1.. = ACK: Present
        .... ..1. = SYN-ACK: Present
        .... ...1 = SYN: Present
        [Completeness Flags: RFDASS]
    [TCP Segment Len: 139]
    Sequence Number: 1429    (relative sequence number)
    Sequence Number (raw): 2446833163
    [Next Sequence Number: 1568    (relative sequence number)]
    Acknowledgment Number: 1    (relative ack number)
    Acknowledgment number (raw): 876870662
    1000 .... = Header Length: 32 bytes (8)
    Flags: 0x018 (PSH, ACK)
        000. .... .... = Reserved: Not set
        ...0 .... .... = Accurate ECN: Not set
        .... 0... .... = Congestion Window Reduced: Not set
        .... .0.. .... = ECN-Echo: Not set
        .... ..0. .... = Urgent: Not set
        .... ...1 .... = Acknowledgment: Set
        .... .... 1... = Push: Set
        .... .... .0.. = Reset: Not set
        .... .... ..0. = Syn: Not set
        .... .... ...0 = Fin: Not set
        [TCP Flags: ·······AP···]
    Window: 2053
    [Calculated window size: 131392]
    [Window size scaling factor: 64]
    Checksum: 0xaff2 [unverified]
    [Checksum Status: Unverified]
    Urgent Pointer: 0
    Options: (12 bytes), No-Operation (NOP), No-Operation (NOP), Timestamps
        TCP Option - No-Operation (NOP)
            Kind: No-Operation (1)
        TCP Option - No-Operation (NOP)
            Kind: No-Operation (1)
        TCP Option - Timestamps: TSval 3138174857, TSecr 1836343114
            Kind: Time Stamp Option (8)
            Length: 10
            Timestamp value: 3138174857
            Timestamp echo reply: 1836343114
    [Timestamps]
        [Time since first frame in this TCP stream: 0.079504000 seconds]
        [Time since previous frame in this TCP stream: 0.000024000 seconds]
    [SEQ/ACK analysis]
        [iRTT: 0.073720000 seconds]
        [Bytes in flight: 1567]
        [Bytes sent since last PSH flag: 1567]
    TCP payload (139 bytes)
    TCP segment data (139 bytes)
[2 Reassembled TCP Segments (1567 bytes): #509396(1428), #509397(139)]
    [Frame: 509396, payload: 0-1427 (1428 bytes)]
    [Frame: 509397, payload: 1428-1566 (139 bytes)]
    [Segment count: 2]
    [Reassembled TCP length: 1567]
    [Reassembled TCP Data […]: 160301061a010006160303df4417813e5bd215204c34bc14b271d4b4728c0dd68d4694688eeeefeae754ab20a2d066c166d823823f22c7b1d60eb470fca2b08ef54a3a3435b8d982e4288e300022130213031301c02cc030c02bc02fcca9cca8c024c028c023c027009]
Transport Layer Security
    TLSv1.3 Record Layer: Handshake Protocol: Client Hello
        Content Type: Handshake (22)
        Version: TLS 1.0 (0x0301)
        Length: 1562
        Handshake Protocol: Client Hello
            Handshake Type: Client Hello (1)
            Length: 1558
            Version: TLS 1.2 (0x0303)
                [Expert Info (Chat/Deprecated): This legacy_version field MUST be ignored. The supported_versions extension is present and MUST be used instead.]
                    [This legacy_version field MUST be ignored. The supported_versions extension is present and MUST be used instead.]
                    [Severity level: Chat]
                    [Group: Deprecated]
            Random: df4417813e5bd215204c34bc14b271d4b4728c0dd68d4694688eeeefeae754ab
            Session ID Length: 32
            Session ID: a2d066c166d823823f22c7b1d60eb470fca2b08ef54a3a3435b8d982e4288e30
            Cipher Suites Length: 34
            Cipher Suites (17 suites)
                Cipher Suite: TLS_AES_256_GCM_SHA384 (0x1302)
                Cipher Suite: TLS_CHACHA20_POLY1305_SHA256 (0x1303)
                Cipher Suite: TLS_AES_128_GCM_SHA256 (0x1301)
                Cipher Suite: TLS_ECDHE_ECDSA_WITH_AES_256_GCM_SHA384 (0xc02c)
                Cipher Suite: TLS_ECDHE_RSA_WITH_AES_256_GCM_SHA384 (0xc030)
                Cipher Suite: TLS_ECDHE_ECDSA_WITH_AES_128_GCM_SHA256 (0xc02b)
                Cipher Suite: TLS_ECDHE_RSA_WITH_AES_128_GCM_SHA256 (0xc02f)
                Cipher Suite: TLS_ECDHE_ECDSA_WITH_CHACHA20_POLY1305_SHA256 (0xcca9)
                Cipher Suite: TLS_ECDHE_RSA_WITH_CHACHA20_POLY1305_SHA256 (0xcca8)
                Cipher Suite: TLS_ECDHE_ECDSA_WITH_AES_256_CBC_SHA384 (0xc024)
                Cipher Suite: TLS_ECDHE_RSA_WITH_AES_256_CBC_SHA384 (0xc028)
                Cipher Suite: TLS_ECDHE_ECDSA_WITH_AES_128_CBC_SHA256 (0xc023)
                Cipher Suite: TLS_ECDHE_RSA_WITH_AES_128_CBC_SHA256 (0xc027)
                Cipher Suite: TLS_DHE_RSA_WITH_AES_256_GCM_SHA384 (0x009f)
                Cipher Suite: TLS_DHE_RSA_WITH_AES_128_GCM_SHA256 (0x009e)
                Cipher Suite: TLS_DHE_RSA_WITH_AES_256_CBC_SHA256 (0x006b)
                Cipher Suite: TLS_DHE_RSA_WITH_AES_128_CBC_SHA256 (0x0067)
            Compression Methods Length: 1
            Compression Methods (1 method)
                Compression Method: null (0)
            Extensions Length: 1451
            Extension: renegotiation_info (len=1)
                Type: renegotiation_info (65281)
                Length: 1
                Renegotiation Info extension
                    Renegotiation info extension length: 0
            Extension: server_name (len=50) name=git-mcp-server-production-a0cf.up.railway.app
                Type: server_name (0)
                Length: 50
                Server Name Indication extension
                    Server Name list length: 48
                    Server Name Type: host_name (0)
                    Server Name length: 45
                    Server Name: git-mcp-server-production-a0cf.up.railway.app
            Extension: ec_point_formats (len=4)
                Type: ec_point_formats (11)
                Length: 4
                EC point formats Length: 3
                Elliptic curves point formats (3)
                    EC point format: uncompressed (0)
                    EC point format: ansiX962_compressed_prime (1)
                    EC point format: ansiX962_compressed_char2 (2)
            Extension: supported_groups (len=18)
                Type: supported_groups (10)
                Length: 18
                Supported Groups List Length: 16
                Supported Groups (8 groups)
                    Supported Group: X25519MLKEM768 (0x11ec)
                    Supported Group: x25519 (0x001d)
                    Supported Group: secp256r1 (0x0017)
                    Supported Group: x448 (0x001e)
                    Supported Group: secp384r1 (0x0018)
                    Supported Group: secp521r1 (0x0019)
                    Supported Group: ffdhe2048 (0x0100)
                    Supported Group: ffdhe3072 (0x0101)
            Extension: session_ticket (len=0)
                Type: session_ticket (35)
                Length: 0
                Session Ticket: <MISSING>
            Extension: application_layer_protocol_negotiation (len=11)
                Type: application_layer_protocol_negotiation (16)
                Length: 11
                ALPN Extension Length: 9
                ALPN Protocol
                    ALPN string length: 8
                    ALPN Next Protocol: http/1.1
            Extension: encrypt_then_mac (len=0)
                Type: encrypt_then_mac (22)
                Length: 0
            Extension: extended_master_secret (len=0)
                Type: extended_master_secret (23)
                Length: 0
            Extension: signature_algorithms (len=54)
                Type: signature_algorithms (13)
                Length: 54
                Signature Hash Algorithms Length: 52
                Signature Hash Algorithms (26 algorithms)
                    Signature Algorithm: Unknown Unknown (0x0905)
                        Signature Hash Algorithm Hash: Unknown (9)
                        Signature Hash Algorithm Signature: Unknown (5)
                    Signature Algorithm: Unknown Unknown (0x0906)
                        Signature Hash Algorithm Hash: Unknown (9)
                        Signature Hash Algorithm Signature: Unknown (6)
                    Signature Algorithm: Unknown Unknown (0x0904)
                        Signature Hash Algorithm Hash: Unknown (9)
                        Signature Hash Algorithm Signature: Unknown (4)
                    Signature Algorithm: ecdsa_secp256r1_sha256 (0x0403)
                        Signature Hash Algorithm Hash: SHA256 (4)
                        Signature Hash Algorithm Signature: ECDSA (3)
                    Signature Algorithm: ecdsa_secp384r1_sha384 (0x0503)
                        Signature Hash Algorithm Hash: SHA384 (5)
                        Signature Hash Algorithm Signature: ECDSA (3)
                    Signature Algorithm: ecdsa_secp521r1_sha512 (0x0603)
                        Signature Hash Algorithm Hash: SHA512 (6)
                        Signature Hash Algorithm Signature: ECDSA (3)
                    Signature Algorithm: ed25519 (0x0807)
                        Signature Hash Algorithm Hash: Unknown (8)
                        Signature Hash Algorithm Signature: Unknown (7)
                    Signature Algorithm: ed448 (0x0808)
                        Signature Hash Algorithm Hash: Unknown (8)
                        Signature Hash Algorithm Signature: Unknown (8)
                    Signature Algorithm: ecdsa_brainpoolP256r1tls13_sha256 (0x081a)
                        Signature Hash Algorithm Hash: Unknown (8)
                        Signature Hash Algorithm Signature: Unknown (26)
                    Signature Algorithm: ecdsa_brainpoolP384r1tls13_sha384 (0x081b)
                        Signature Hash Algorithm Hash: Unknown (8)
                        Signature Hash Algorithm Signature: Unknown (27)
                    Signature Algorithm: ecdsa_brainpoolP512r1tls13_sha512 (0x081c)
                        Signature Hash Algorithm Hash: Unknown (8)
                        Signature Hash Algorithm Signature: Unknown (28)
                    Signature Algorithm: rsa_pss_pss_sha256 (0x0809)
                        Signature Hash Algorithm Hash: Unknown (8)
                        Signature Hash Algorithm Signature: Unknown (9)
                    Signature Algorithm: rsa_pss_pss_sha384 (0x080a)
                        Signature Hash Algorithm Hash: Unknown (8)
                        Signature Hash Algorithm Signature: Unknown (10)
                    Signature Algorithm: rsa_pss_pss_sha512 (0x080b)
                        Signature Hash Algorithm Hash: Unknown (8)
                        Signature Hash Algorithm Signature: Unknown (11)
                    Signature Algorithm: rsa_pss_rsae_sha256 (0x0804)
                        Signature Hash Algorithm Hash: Unknown (8)
                        Signature Hash Algorithm Signature: Unknown (4)
                    Signature Algorithm: rsa_pss_rsae_sha384 (0x0805)
                        Signature Hash Algorithm Hash: Unknown (8)
                        Signature Hash Algorithm Signature: Unknown (5)
                    Signature Algorithm: rsa_pss_rsae_sha512 (0x0806)
                        Signature Hash Algorithm Hash: Unknown (8)
                        Signature Hash Algorithm Signature: Unknown (6)
                    Signature Algorithm: rsa_pkcs1_sha256 (0x0401)
                        Signature Hash Algorithm Hash: SHA256 (4)
                        Signature Hash Algorithm Signature: RSA (1)
                    Signature Algorithm: rsa_pkcs1_sha384 (0x0501)
                        Signature Hash Algorithm Hash: SHA384 (5)
                        Signature Hash Algorithm Signature: RSA (1)
                    Signature Algorithm: rsa_pkcs1_sha512 (0x0601)
                        Signature Hash Algorithm Hash: SHA512 (6)
                        Signature Hash Algorithm Signature: RSA (1)
                    Signature Algorithm: SHA224 ECDSA (0x0303)
                        Signature Hash Algorithm Hash: SHA224 (3)
                        Signature Hash Algorithm Signature: ECDSA (3)
                    Signature Algorithm: SHA224 RSA (0x0301)
                        Signature Hash Algorithm Hash: SHA224 (3)
                        Signature Hash Algorithm Signature: RSA (1)
                    Signature Algorithm: SHA224 DSA (0x0302)
                        Signature Hash Algorithm Hash: SHA224 (3)
                        Signature Hash Algorithm Signature: DSA (2)
                    Signature Algorithm: SHA256 DSA (0x0402)
                        Signature Hash Algorithm Hash: SHA256 (4)
                        Signature Hash Algorithm Signature: DSA (2)
                    Signature Algorithm: SHA384 DSA (0x0502)
                        Signature Hash Algorithm Hash: SHA384 (5)
                        Signature Hash Algorithm Signature: DSA (2)
                    Signature Algorithm: SHA512 DSA (0x0602)
                        Signature Hash Algorithm Hash: SHA512 (6)
                        Signature Hash Algorithm Signature: DSA (2)
            Extension: supported_versions (len=5) TLS 1.3, TLS 1.2
                Type: supported_versions (43)
                Length: 5
                Supported Versions length: 4
                Supported Version: TLS 1.3 (0x0304)
                Supported Version: TLS 1.2 (0x0303)
            Extension: psk_key_exchange_modes (len=2)
                Type: psk_key_exchange_modes (45)
                Length: 2
                PSK Key Exchange Modes Length: 1
                PSK Key Exchange Mode: PSK with (EC)DHE key establishment (psk_dhe_ke) (1)
            Extension: key_share (len=1258) X25519MLKEM768, x25519
                Type: key_share (51)
                Length: 1258
                Key Share extension
                    Client Key Share Length: 1256
                    Key Share Entry: Group: X25519MLKEM768, Key Exchange length: 1216
                        Group: X25519MLKEM768 (4588)
                        Key Exchange Length: 1216
                        Key Exchange […]: 9ee43c7c872333c2c3f2a2bbc91c05b5a72231535f5f7b34fda9647ac239b0fa7d08711b7fc6983a0a06a511c6274355c9a6794927a29d8690c0963eee1c1964903f5de10db2f20637934033428c1d43c228e21e7a15a9d8b60ba6f219b4ab6c55504177f0b0f6432e3df50c02b
                    Key Share Entry: Group: x25519, Key Exchange length: 32
                        Group: x25519 (29)
                        Key Exchange Length: 32
                        Key Exchange: 62a881699ad8a725921d313b66280a949f689f184ad550ce18c8ccbae6c20867
            [JA4: t13d1712h1_ab0a1bf427ad_8e6e362c5eac]
            [JA4_r […]: t13d1712h1_0067,006b,009e,009f,1301,1302,1303,c023,c024,c027,c028,c02b,c02c,c02f,c030,cca8,cca9_000a,000b,000d,0016,0017,0023,002b,002d,0033,ff01_0905,0906,0904,0403,0503,0603,0807,0808,081a,081b,081c,0809,080a,080b,0804,0805,]
            [JA3 Fullstring: 771,4866-4867-4865-49196-49200-49195-49199-52393-52392-49188-49192-49187-49191-159-158-107-103,65281-0-11-10-35-16-22-23-13-43-45-51,4588-29-23-30-24-25-256-257,0-1-2]
            [JA3: 37f7d09ced1a845dc48872abc1a29d7b]

No.     Time           Source                Destination           Protocol Length Info
 509529 232.803345     66.33.22.59           192.168.0.7           TCP      66     443 → 49342 [ACK] Seq=1 Ack=1568 Win=63616 Len=0 TSval=1836343194 TSecr=3138174857

Frame 509529: 66 bytes on wire (528 bits), 66 bytes captured (528 bits) on interface en0, id 0
    Section number: 1
    Interface id: 0 (en0)
        Interface name: en0
        Interface description: Wi-Fi
    Encapsulation type: Ethernet (1)
    Arrival Time: Sep 21, 2025 13:31:21.578744000 CST
    UTC Arrival Time: Sep 21, 2025 19:31:21.578744000 UTC
    Epoch Arrival Time: 1758483081.578744000
    [Time shift for this packet: 0.000000000 seconds]
    [Time delta from previous captured frame: 0.001404000 seconds]
    [Time delta from previous displayed frame: 0.074124000 seconds]
