No.     Time           Source                Destination           Protocol Length Info
  12960 3.194910       66.33.22.59           192.168.0.7           TCP      66     443 → 51794 [ACK] Seq=1 Ack=1 Win=501 Len=0 TSval=845019047 TSecr=3634670817

Frame 12960: 66 bytes on wire (528 bits), 66 bytes captured (528 bits) on interface en0, id 0
    Section number: 1
    Interface id: 0 (en0)
        Interface name: en0
        Interface description: Wi-Fi
    Encapsulation type: Ethernet (1)
    Arrival Time: Sep 21, 2025 14:33:38.686606000 CST
    UTC Arrival Time: Sep 21, 2025 20:33:38.686606000 UTC
    Epoch Arrival Time: 1758486818.686606000
    [Time shift for this packet: 0.000000000 seconds]
    [Time delta from previous captured frame: 0.000001000 seconds]
    [Time delta from previous displayed frame: 0.000000000 seconds]
    [Time since reference or first frame: 3.194910000 seconds]
    Frame Number: 12960
    Frame Length: 66 bytes (528 bits)
    Capture Length: 66 bytes (528 bits)
    [Frame is marked: False]
    [Frame is ignored: False]
    [Protocols in frame: eth:ethertype:ip:tcp]
    [Coloring Rule Name: TCP]
    [Coloring Rule String: tcp]
Ethernet II, Src: Commscope_eb:d5:16 (c0:89:ab:eb:d5:16), Dst: 06:34:e6:94:64:f2 (06:34:e6:94:64:f2)
    Destination: 06:34:e6:94:64:f2 (06:34:e6:94:64:f2)
        .... ..1. .... .... .... .... = LG bit: Locally administered address (this is NOT the factory default)
        .... ...0 .... .... .... .... = IG bit: Individual address (unicast)
    Source: Commscope_eb:d5:16 (c0:89:ab:eb:d5:16)
        .... ..0. .... .... .... .... = LG bit: Globally unique address (factory default)
        .... ...0 .... .... .... .... = IG bit: Individual address (unicast)
    Type: IPv4 (0x0800)
    [Stream index: 0]
Internet Protocol Version 4, Src: 66.33.22.59, Dst: 192.168.0.7
    0100 .... = Version: 4
    .... 0101 = Header Length: 20 bytes (5)
    Differentiated Services Field: 0x00 (DSCP: CS0, ECN: Not-ECT)
        0000 00.. = Differentiated Services Codepoint: Default (0)
        .... ..00 = Explicit Congestion Notification: Not ECN-Capable Transport (0)
    Total Length: 52
    Identification: 0x23d9 (9177)
    010. .... = Flags: 0x2, Don't fragment
        0... .... = Reserved bit: Not set
        .1.. .... = Don't fragment: Set
        ..0. .... = More fragments: Not set
    ...0 0000 0000 0000 = Fragment Offset: 0
    Time to Live: 45
    Protocol: TCP (6)
    Header Checksum: 0x10e0 [validation disabled]
    [Header checksum status: Unverified]
    Source Address: 66.33.22.59
    Destination Address: 192.168.0.7
    [Stream index: 11]
Transmission Control Protocol, Src Port: 443, Dst Port: 51794, Seq: 1, Ack: 1, Len: 0
    Source Port: 443
    Destination Port: 51794
    [Stream index: 6]
    [Stream Packet Number: 1]
    [Conversation completeness: Incomplete (60)]
        ..1. .... = RST: Present
        ...1 .... = FIN: Present
        .... 1... = Data: Present
        .... .1.. = ACK: Present
        .... ..0. = SYN-ACK: Absent
        .... ...0 = SYN: Absent
        [Completeness Flags: RFDA··]
    [TCP Segment Len: 0]
    Sequence Number: 1    (relative sequence number)
    Sequence Number (raw): 562230799
    [Next Sequence Number: 1    (relative sequence number)]
    Acknowledgment Number: 1    (relative ack number)
    Acknowledgment number (raw): 871552180
    1000 .... = Header Length: 32 bytes (8)
    Flags: 0x010 (ACK)
        000. .... .... = Reserved: Not set
        ...0 .... .... = Accurate ECN: Not set
        .... 0... .... = Congestion Window Reduced: Not set
        .... .0.. .... = ECN-Echo: Not set
        .... ..0. .... = Urgent: Not set
        .... ...1 .... = Acknowledgment: Set
        .... .... 0... = Push: Not set
        .... .... .0.. = Reset: Not set
        .... .... ..0. = Syn: Not set
        .... .... ...0 = Fin: Not set
        [TCP Flags: ·······A····]
    Window: 501
    [Calculated window size: 501]
    [Window size scaling factor: -1 (unknown)]
    Checksum: 0xbfea [unverified]
    [Checksum Status: Unverified]
    Urgent Pointer: 0
    Options: (12 bytes), No-Operation (NOP), No-Operation (NOP), Timestamps
        TCP Option - No-Operation (NOP)
            Kind: No-Operation (1)
        TCP Option - No-Operation (NOP)
            Kind: No-Operation (1)
        TCP Option - Timestamps: TSval 845019047, TSecr 3634670817
            Kind: Time Stamp Option (8)
            Length: 10
            Timestamp value: 845019047
            Timestamp echo reply: 3634670817
    [Timestamps]
        [Time since first frame in this TCP stream: 0.000000000 seconds]
        [Time since previous frame in this TCP stream: 0.000000000 seconds]

No.     Time           Source                Destination           Protocol Length Info
  12961 3.195014       192.168.0.7           66.33.22.59           TCP      66     [TCP ACKed unseen segment] 51794 → 443 [ACK] Seq=1 Ack=2 Win=2048 Len=0 TSval=3634686006 TSecr=844988784

Frame 12961: 66 bytes on wire (528 bits), 66 bytes captured (528 bits) on interface en0, id 0
    Section number: 1
    Interface id: 0 (en0)
        Interface name: en0
        Interface description: Wi-Fi
    Encapsulation type: Ethernet (1)
    Arrival Time: Sep 21, 2025 14:33:38.686710000 CST
    UTC Arrival Time: Sep 21, 2025 20:33:38.686710000 UTC
    Epoch Arrival Time: 1758486818.686710000
    [Time shift for this packet: 0.000000000 seconds]
    [Time delta from previous captured frame: 0.000104000 seconds]
    [Time delta from previous displayed frame: 0.000104000 seconds]
    [Time since reference or first frame: 3.195014000 seconds]
    Frame Number: 12961
    Frame Length: 66 bytes (528 bits)
    Capture Length: 66 bytes (528 bits)
    [Frame is marked: False]
    [Frame is ignored: False]
    [Protocols in frame: eth:ethertype:ip:tcp]
    [Coloring Rule Name: Bad TCP]
    [Coloring Rule String: tcp.analysis.flags && !tcp.analysis.window_update && !tcp.analysis.keep_alive && !tcp.analysis.keep_alive_ack]
Ethernet II, Src: 06:34:e6:94:64:f2 (06:34:e6:94:64:f2), Dst: Commscope_eb:d5:16 (c0:89:ab:eb:d5:16)
    Destination: Commscope_eb:d5:16 (c0:89:ab:eb:d5:16)
        .... ..0. .... .... .... .... = LG bit: Globally unique address (factory default)
        .... ...0 .... .... .... .... = IG bit: Individual address (unicast)
    Source: 06:34:e6:94:64:f2 (06:34:e6:94:64:f2)
        .... ..1. .... .... .... .... = LG bit: Locally administered address (this is NOT the factory default)
        .... ...0 .... .... .... .... = IG bit: Individual address (unicast)
    Type: IPv4 (0x0800)
    [Stream index: 0]
Internet Protocol Version 4, Src: 192.168.0.7, Dst: 66.33.22.59
    0100 .... = Version: 4
    .... 0101 = Header Length: 20 bytes (5)
    Differentiated Services Field: 0x00 (DSCP: CS0, ECN: Not-ECT)
        0000 00.. = Differentiated Services Codepoint: Default (0)
        .... ..00 = Explicit Congestion Notification: Not ECN-Capable Transport (0)
    Total Length: 52
    Identification: 0x0000 (0)
    010. .... = Flags: 0x2, Don't fragment
        0... .... = Reserved bit: Not set
        .1.. .... = Don't fragment: Set
        ..0. .... = More fragments: Not set
    ...0 0000 0000 0000 = Fragment Offset: 0
    Time to Live: 64
    Protocol: TCP (6)
    Header Checksum: 0x21b9 [validation disabled]
    [Header checksum status: Unverified]
    Source Address: 192.168.0.7
    Destination Address: 66.33.22.59
    [Stream index: 11]
Transmission Control Protocol, Src Port: 51794, Dst Port: 443, Seq: 1, Ack: 2, Len: 0
    Source Port: 51794
    Destination Port: 443
    [Stream index: 6]
    [Stream Packet Number: 2]
    [Conversation completeness: Incomplete (60)]
        ..1. .... = RST: Present
        ...1 .... = FIN: Present
        .... 1... = Data: Present
        .... .1.. = ACK: Present
        .... ..0. = SYN-ACK: Absent
        .... ...0 = SYN: Absent
        [Completeness Flags: RFDA··]
    [TCP Segment Len: 0]
    Sequence Number: 1    (relative sequence number)
    Sequence Number (raw): 871552180
    [Next Sequence Number: 1    (relative sequence number)]
    Acknowledgment Number: 2    (relative ack number)
    Acknowledgment number (raw): 562230800
    1000 .... = Header Length: 32 bytes (8)
    Flags: 0x010 (ACK)
        000. .... .... = Reserved: Not set
        ...0 .... .... = Accurate ECN: Not set
        .... 0... .... = Congestion Window Reduced: Not set
        .... .0.. .... = ECN-Echo: Not set
        .... ..0. .... = Urgent: Not set
        .... ...1 .... = Acknowledgment: Set
        .... .... 0... = Push: Not set
        .... .... .0.. = Reset: Not set
        .... .... ..0. = Syn: Not set
        .... .... ...0 = Fin: Not set
        [TCP Flags: ·······A····]
    Window: 2048
    [Calculated window size: 2048]
    [Window size scaling factor: -1 (unknown)]
    Checksum: 0xf4c0 [unverified]
    [Checksum Status: Unverified]
    Urgent Pointer: 0
    Options: (12 bytes), No-Operation (NOP), No-Operation (NOP), Timestamps
        TCP Option - No-Operation (NOP)
            Kind: No-Operation (1)
        TCP Option - No-Operation (NOP)
            Kind: No-Operation (1)
        TCP Option - Timestamps: TSval 3634686006, TSecr 844988784
            Kind: Time Stamp Option (8)
            Length: 10
            Timestamp value: 3634686006
            Timestamp echo reply: 844988784
    [Timestamps]
        [Time since first frame in this TCP stream: 0.000104000 seconds]
        [Time since previous frame in this TCP stream: 0.000104000 seconds]
    [SEQ/ACK analysis]
        [TCP Analysis Flags]
            [Expert Info (Warning/Sequence): ACKed segment that wasn't captured (common at capture start)]
                [ACKed segment that wasn't captured (common at capture start)]
                [Severity level: Warning]
                [Group: Sequence]

No.     Time           Source                Destination           Protocol Length Info
  37260 18.297936      66.33.22.59           192.168.0.7           TCP      66     [TCP Dup ACK 12960#1] 443 → 51794 [ACK] Seq=1 Ack=1 Win=501 Len=0 TSval=845034151 TSecr=3634686006

Frame 37260: 66 bytes on wire (528 bits), 66 bytes captured (528 bits) on interface en0, id 0
    Section number: 1
    Interface id: 0 (en0)
        Interface name: en0
        Interface description: Wi-Fi
    Encapsulation type: Ethernet (1)
    Arrival Time: Sep 21, 2025 14:33:53.789632000 CST
    UTC Arrival Time: Sep 21, 2025 20:33:53.789632000 UTC
    Epoch Arrival Time: 1758486833.789632000
    [Time shift for this packet: 0.000000000 seconds]
    [Time delta from previous captured frame: 0.007766000 seconds]
    [Time delta from previous displayed frame: 15.102922000 seconds]
    [Time since reference or first frame: 18.297936000 seconds]
    Frame Number: 37260
    Frame Length: 66 bytes (528 bits)
    Capture Length: 66 bytes (528 bits)
    [Frame is marked: False]
    [Frame is ignored: False]
    [Protocols in frame: eth:ethertype:ip:tcp]
    [Coloring Rule Name: Bad TCP]
    [Coloring Rule String: tcp.analysis.flags && !tcp.analysis.window_update && !tcp.analysis.keep_alive && !tcp.analysis.keep_alive_ack]
Ethernet II, Src: Commscope_eb:d5:16 (c0:89:ab:eb:d5:16), Dst: 06:34:e6:94:64:f2 (06:34:e6:94:64:f2)
    Destination: 06:34:e6:94:64:f2 (06:34:e6:94:64:f2)
        .... ..1. .... .... .... .... = LG bit: Locally administered address (this is NOT the factory default)
        .... ...0 .... .... .... .... = IG bit: Individual address (unicast)
    Source: Commscope_eb:d5:16 (c0:89:ab:eb:d5:16)
        .... ..0. .... .... .... .... = LG bit: Globally unique address (factory default)
        .... ...0 .... .... .... .... = IG bit: Individual address (unicast)
    Type: IPv4 (0x0800)
    [Stream index: 0]
Internet Protocol Version 4, Src: 66.33.22.59, Dst: 192.168.0.7
    0100 .... = Version: 4
    .... 0101 = Header Length: 20 bytes (5)
    Differentiated Services Field: 0x00 (DSCP: CS0, ECN: Not-ECT)
        0000 00.. = Differentiated Services Codepoint: Default (0)
        .... ..00 = Explicit Congestion Notification: Not ECN-Capable Transport (0)
    Total Length: 52
    Identification: 0x23da (9178)
    010. .... = Flags: 0x2, Don't fragment
        0... .... = Reserved bit: Not set
        .1.. .... = Don't fragment: Set
        ..0. .... = More fragments: Not set
    ...0 0000 0000 0000 = Fragment Offset: 0
    Time to Live: 45
    Protocol: TCP (6)
    Header Checksum: 0x10df [validation disabled]
    [Header checksum status: Unverified]
    Source Address: 66.33.22.59
    Destination Address: 192.168.0.7
    [Stream index: 11]
Transmission Control Protocol, Src Port: 443, Dst Port: 51794, Seq: 1, Ack: 1, Len: 0
    Source Port: 443
    Destination Port: 51794
    [Stream index: 6]
    [Stream Packet Number: 3]
    [Conversation completeness: Incomplete (60)]
        ..1. .... = RST: Present
        ...1 .... = FIN: Present
        .... 1... = Data: Present
        .... .1.. = ACK: Present
        .... ..0. = SYN-ACK: Absent
        .... ...0 = SYN: Absent
        [Completeness Flags: RFDA··]
    [TCP Segment Len: 0]
    Sequence Number: 1    (relative sequence number)
    Sequence Number (raw): 562230799
    [Next Sequence Number: 1    (relative sequence number)]
    Acknowledgment Number: 1    (relative ack number)
    Acknowledgment number (raw): 871552180
    1000 .... = Header Length: 32 bytes (8)
    Flags: 0x010 (ACK)
        000. .... .... = Reserved: Not set
        ...0 .... .... = Accurate ECN: Not set
        .... 0... .... = Congestion Window Reduced: Not set
        .... .0.. .... = ECN-Echo: Not set
        .... ..0. .... = Urgent: Not set
        .... ...1 .... = Acknowledgment: Set
        .... .... 0... = Push: Not set
        .... .... .0.. = Reset: Not set
        .... .... ..0. = Syn: Not set
        .... .... ...0 = Fin: Not set
        [TCP Flags: ·······A····]
    Window: 501
    [Calculated window size: 501]
    [Window size scaling factor: -1 (unknown)]
    Checksum: 0x4995 [unverified]
    [Checksum Status: Unverified]
    Urgent Pointer: 0
    Options: (12 bytes), No-Operation (NOP), No-Operation (NOP), Timestamps
        TCP Option - No-Operation (NOP)
            Kind: No-Operation (1)
        TCP Option - No-Operation (NOP)
            Kind: No-Operation (1)
        TCP Option - Timestamps: TSval 845034151, TSecr 3634686006
            Kind: Time Stamp Option (8)
            Length: 10
            Timestamp value: 845034151
            Timestamp echo reply: 3634686006
    [Timestamps]
        [Time since first frame in this TCP stream: 15.103026000 seconds]
        [Time since previous frame in this TCP stream: 15.102922000 seconds]
    [SEQ/ACK analysis]
        [TCP Analysis Flags]
            [This is a TCP duplicate ack]
        [Duplicate ACK #: 1]
        [Duplicate to the ACK in frame: 12960]
            [Expert Info (Note/Sequence): Duplicate ACK (#1)]
                [Duplicate ACK (#1)]
                [Severity level: Note]
                [Group: Sequence]

No.     Time           Source                Destination           Protocol Length Info
  37261 18.298137      192.168.0.7           66.33.22.59           TCP      66     [TCP Dup ACK 12961#1] 51794 → 443 [ACK] Seq=1 Ack=2 Win=2048 Len=0 TSval=3634701109 TSecr=844988784

Frame 37261: 66 bytes on wire (528 bits), 66 bytes captured (528 bits) on interface en0, id 0
    Section number: 1
    Interface id: 0 (en0)
        Interface name: en0
        Interface description: Wi-Fi
    Encapsulation type: Ethernet (1)
    Arrival Time: Sep 21, 2025 14:33:53.789833000 CST
    UTC Arrival Time: Sep 21, 2025 20:33:53.789833000 UTC
    Epoch Arrival Time: 1758486833.789833000
    [Time shift for this packet: 0.000000000 seconds]
    [Time delta from previous captured frame: 0.000201000 seconds]
    [Time delta from previous displayed frame: 0.000201000 seconds]
    [Time since reference or first frame: 18.298137000 seconds]
    Frame Number: 37261
    Frame Length: 66 bytes (528 bits)
    Capture Length: 66 bytes (528 bits)
    [Frame is marked: False]
    [Frame is ignored: False]
    [Protocols in frame: eth:ethertype:ip:tcp]
    [Coloring Rule Name: Bad TCP]
    [Coloring Rule String: tcp.analysis.flags && !tcp.analysis.window_update && !tcp.analysis.keep_alive && !tcp.analysis.keep_alive_ack]
Ethernet II, Src: 06:34:e6:94:64:f2 (06:34:e6:94:64:f2), Dst: Commscope_eb:d5:16 (c0:89:ab:eb:d5:16)
    Destination: Commscope_eb:d5:16 (c0:89:ab:eb:d5:16)
        .... ..0. .... .... .... .... = LG bit: Globally unique address (factory default)
        .... ...0 .... .... .... .... = IG bit: Individual address (unicast)
    Source: 06:34:e6:94:64:f2 (06:34:e6:94:64:f2)
        .... ..1. .... .... .... .... = LG bit: Locally administered address (this is NOT the factory default)
        .... ...0 .... .... .... .... = IG bit: Individual address (unicast)
    Type: IPv4 (0x0800)
    [Stream index: 0]
Internet Protocol Version 4, Src: 192.168.0.7, Dst: 66.33.22.59
    0100 .... = Version: 4
    .... 0101 = Header Length: 20 bytes (5)
    Differentiated Services Field: 0x00 (DSCP: CS0, ECN: Not-ECT)
        0000 00.. = Differentiated Services Codepoint: Default (0)
        .... ..00 = Explicit Congestion Notification: Not ECN-Capable Transport (0)
    Total Length: 52
    Identification: 0x0000 (0)
    010. .... = Flags: 0x2, Don't fragment
        0... .... = Reserved bit: Not set
        .1.. .... = Don't fragment: Set
        ..0. .... = More fragments: Not set
    ...0 0000 0000 0000 = Fragment Offset: 0
    Time to Live: 64
    Protocol: TCP (6)
    Header Checksum: 0x21b9 [validation disabled]
    [Header checksum status: Unverified]
    Source Address: 192.168.0.7
    Destination Address: 66.33.22.59
    [Stream index: 11]
Transmission Control Protocol, Src Port: 51794, Dst Port: 443, Seq: 1, Ack: 2, Len: 0
    Source Port: 51794
    Destination Port: 443
    [Stream index: 6]
    [Stream Packet Number: 4]
    [Conversation completeness: Incomplete (60)]
        ..1. .... = RST: Present
        ...1 .... = FIN: Present
        .... 1... = Data: Present
        .... .1.. = ACK: Present
        .... ..0. = SYN-ACK: Absent
        .... ...0 = SYN: Absent
        [Completeness Flags: RFDA··]
    [TCP Segment Len: 0]
    Sequence Number: 1    (relative sequence number)
    Sequence Number (raw): 871552180
    [Next Sequence Number: 1    (relative sequence number)]
    Acknowledgment Number: 2    (relative ack number)
    Acknowledgment number (raw): 562230800
    1000 .... = Header Length: 32 bytes (8)
    Flags: 0x010 (ACK)
        000. .... .... = Reserved: Not set
        ...0 .... .... = Accurate ECN: Not set
        .... 0... .... = Congestion Window Reduced: Not set
        .... .0.. .... = ECN-Echo: Not set
        .... ..0. .... = Urgent: Not set
        .... ...1 .... = Acknowledgment: Set
        .... .... 0... = Push: Not set
        .... .... .0.. = Reset: Not set
        .... .... ..0. = Syn: Not set
        .... .... ...0 = Fin: Not set
        [TCP Flags: ·······A····]
    Window: 2048
    [Calculated window size: 2048]
    [Window size scaling factor: -1 (unknown)]
    Checksum: 0xb9c1 [unverified]
    [Checksum Status: Unverified]
    Urgent Pointer: 0
    Options: (12 bytes), No-Operation (NOP), No-Operation (NOP), Timestamps
        TCP Option - No-Operation (NOP)
            Kind: No-Operation (1)
        TCP Option - No-Operation (NOP)
            Kind: No-Operation (1)
        TCP Option - Timestamps: TSval 3634701109, TSecr 844988784
            Kind: Time Stamp Option (8)
            Length: 10
            Timestamp value: 3634701109
            Timestamp echo reply: 844988784
    [Timestamps]
        [Time since first frame in this TCP stream: 15.103227000 seconds]
        [Time since previous frame in this TCP stream: 0.000201000 seconds]
    [SEQ/ACK analysis]
        [TCP Analysis Flags]
            [This is a TCP duplicate ack]
        [Duplicate ACK #: 1]
        [Duplicate to the ACK in frame: 12961]
            [Expert Info (Note/Sequence): Duplicate ACK (#1)]
                [Duplicate ACK (#1)]
                [Severity level: Note]
                [Group: Sequence]

No.     Time           Source                Destination           Protocol Length Info
  81429 32.931373      66.33.22.59           192.168.0.7           TLSv1.2  90     [TCP Previous segment not captured] , Application Data

Frame 81429: 90 bytes on wire (720 bits), 90 bytes captured (720 bits) on interface en0, id 0
    Section number: 1
    Interface id: 0 (en0)
        Interface name: en0
        Interface description: Wi-Fi
    Encapsulation type: Ethernet (1)
    Arrival Time: Sep 21, 2025 14:34:08.423069000 CST
    UTC Arrival Time: Sep 21, 2025 20:34:08.423069000 UTC
    Epoch Arrival Time: 1758486848.423069000
    [Time shift for this packet: 0.000000000 seconds]
    [Time delta from previous captured frame: 0.001720000 seconds]
    [Time delta from previous displayed frame: 14.633236000 seconds]
    [Time since reference or first frame: 32.931373000 seconds]
    Frame Number: 81429
    Frame Length: 90 bytes (720 bits)
    Capture Length: 90 bytes (720 bits)
    [Frame is marked: False]
    [Frame is ignored: False]
    [Protocols in frame: eth:ethertype:ip:tcp:tls]
    [Coloring Rule Name: Bad TCP]
    [Coloring Rule String: tcp.analysis.flags && !tcp.analysis.window_update && !tcp.analysis.keep_alive && !tcp.analysis.keep_alive_ack]
Ethernet II, Src: Commscope_eb:d5:16 (c0:89:ab:eb:d5:16), Dst: 06:34:e6:94:64:f2 (06:34:e6:94:64:f2)
    Destination: 06:34:e6:94:64:f2 (06:34:e6:94:64:f2)
        .... ..1. .... .... .... .... = LG bit: Locally administered address (this is NOT the factory default)
        .... ...0 .... .... .... .... = IG bit: Individual address (unicast)
    Source: Commscope_eb:d5:16 (c0:89:ab:eb:d5:16)
        .... ..0. .... .... .... .... = LG bit: Globally unique address (factory default)
        .... ...0 .... .... .... .... = IG bit: Individual address (unicast)
    Type: IPv4 (0x0800)
    [Stream index: 0]
Internet Protocol Version 4, Src: 66.33.22.59, Dst: 192.168.0.7
    0100 .... = Version: 4
    .... 0101 = Header Length: 20 bytes (5)
    Differentiated Services Field: 0x02 (DSCP: CS0, ECN: ECT(0))
        0000 00.. = Differentiated Services Codepoint: Default (0)
        .... ..10 = Explicit Congestion Notification: ECN-Capable Transport codepoint '10' (2)
    Total Length: 76
    Identification: 0x23db (9179)
    010. .... = Flags: 0x2, Don't fragment
        0... .... = Reserved bit: Not set
        .1.. .... = Don't fragment: Set
        ..0. .... = More fragments: Not set
    ...0 0000 0000 0000 = Fragment Offset: 0
    Time to Live: 45
    Protocol: TCP (6)
    Header Checksum: 0x10c4 [validation disabled]
    [Header checksum status: Unverified]
    Source Address: 66.33.22.59
    Destination Address: 192.168.0.7
    [Stream index: 11]
Transmission Control Protocol, Src Port: 443, Dst Port: 51794, Seq: 2, Ack: 1, Len: 24
    Source Port: 443
    Destination Port: 51794
    [Stream index: 6]
    [Stream Packet Number: 5]
    [Conversation completeness: Incomplete (60)]
        ..1. .... = RST: Present
        ...1 .... = FIN: Present
        .... 1... = Data: Present
        .... .1.. = ACK: Present
        .... ..0. = SYN-ACK: Absent
        .... ...0 = SYN: Absent
        [Completeness Flags: RFDA··]
    [TCP Segment Len: 24]
    Sequence Number: 2    (relative sequence number)
    Sequence Number (raw): 562230800
    [Next Sequence Number: 26    (relative sequence number)]
    Acknowledgment Number: 1    (relative ack number)
    Acknowledgment number (raw): 871552180
    1000 .... = Header Length: 32 bytes (8)
    Flags: 0x018 (PSH, ACK)
        000. .... .... = Reserved: Not set
        ...0 .... .... = Accurate ECN: Not set
        .... 0... .... = Congestion Window Reduced: Not set
        .... .0.. .... = ECN-Echo: Not set
        .... ..0. .... = Urgent: Not set
        .... ...1 .... = Acknowledgment: Set
        .... .... 1... = Push: Set
        .... .... .0.. = Reset: Not set
        .... .... ..0. = Syn: Not set
        .... .... ...0 = Fin: Not set
        [TCP Flags: ·······AP···]
    Window: 501
    [Calculated window size: 501]
    [Window size scaling factor: -1 (unknown)]
    Checksum: 0x4a99 [unverified]
    [Checksum Status: Unverified]
    Urgent Pointer: 0
    Options: (12 bytes), No-Operation (NOP), No-Operation (NOP), Timestamps
        TCP Option - No-Operation (NOP)
            Kind: No-Operation (1)
        TCP Option - No-Operation (NOP)
            Kind: No-Operation (1)
        TCP Option - Timestamps: TSval 845048784, TSecr 3634701109
            Kind: Time Stamp Option (8)
            Length: 10
            Timestamp value: 845048784
            Timestamp echo reply: 3634701109
    [Timestamps]
        [Time since first frame in this TCP stream: 29.736463000 seconds]
        [Time since previous frame in this TCP stream: 14.633236000 seconds]
    [SEQ/ACK analysis]
        [TCP Analysis Flags]
            [Expert Info (Warning/Sequence): Previous segment(s) not captured (common at capture start)]
                [Previous segment(s) not captured (common at capture start)]
                [Severity level: Warning]
                [Group: Sequence]
    TCP payload (24 bytes)
Transport Layer Security
    TLSv1.2 Record Layer: Application Data Protocol: Hypertext Transfer Protocol
        Content Type: Application Data (23)
        Version: TLS 1.2 (0x0303)
        Length: 19
        Encrypted Application Data: 784af8f9dc49973eaed944013f15f246a15905
        [Application Data Protocol: Hypertext Transfer Protocol]

No.     Time           Source                Destination           Protocol Length Info
  81430 32.931374      66.33.22.59           192.168.0.7           TCP      66     443 → 51794 [FIN, ACK] Seq=26 Ack=1 Win=501 Len=0 TSval=845048784 TSecr=3634701109

Frame 81430: 66 bytes on wire (528 bits), 66 bytes captured (528 bits) on interface en0, id 0
    Section number: 1
    Interface id: 0 (en0)
        Interface name: en0
        Interface description: Wi-Fi
    Encapsulation type: Ethernet (1)
    Arrival Time: Sep 21, 2025 14:34:08.423070000 CST
    UTC Arrival Time: Sep 21, 2025 20:34:08.423070000 UTC
    Epoch Arrival Time: 1758486848.423070000
    [Time shift for this packet: 0.000000000 seconds]
    [Time delta from previous captured frame: 0.000001000 seconds]
    [Time delta from previous displayed frame: 0.000001000 seconds]
    [Time since reference or first frame: 32.931374000 seconds]
    Frame Number: 81430
    Frame Length: 66 bytes (528 bits)
    Capture Length: 66 bytes (528 bits)
    [Frame is marked: False]
    [Frame is ignored: False]
    [Protocols in frame: eth:ethertype:ip:tcp]
    [Coloring Rule Name: TCP SYN/FIN]
    [Coloring Rule String: tcp.flags & 0x02 || tcp.flags.fin == 1]
Ethernet II, Src: Commscope_eb:d5:16 (c0:89:ab:eb:d5:16), Dst: 06:34:e6:94:64:f2 (06:34:e6:94:64:f2)
    Destination: 06:34:e6:94:64:f2 (06:34:e6:94:64:f2)
        .... ..1. .... .... .... .... = LG bit: Locally administered address (this is NOT the factory default)
        .... ...0 .... .... .... .... = IG bit: Individual address (unicast)
    Source: Commscope_eb:d5:16 (c0:89:ab:eb:d5:16)
        .... ..0. .... .... .... .... = LG bit: Globally unique address (factory default)
        .... ...0 .... .... .... .... = IG bit: Individual address (unicast)
    Type: IPv4 (0x0800)
    [Stream index: 0]
Internet Protocol Version 4, Src: 66.33.22.59, Dst: 192.168.0.7
    0100 .... = Version: 4
    .... 0101 = Header Length: 20 bytes (5)
    Differentiated Services Field: 0x00 (DSCP: CS0, ECN: Not-ECT)
        0000 00.. = Differentiated Services Codepoint: Default (0)
        .... ..00 = Explicit Congestion Notification: Not ECN-Capable Transport (0)
    Total Length: 52
    Identification: 0x23dc (9180)
    010. .... = Flags: 0x2, Don't fragment
        0... .... = Reserved bit: Not set
        .1.. .... = Don't fragment: Set
        ..0. .... = More fragments: Not set
    ...0 0000 0000 0000 = Fragment Offset: 0
    Time to Live: 45
    Protocol: TCP (6)
    Header Checksum: 0x10dd [validation disabled]
    [Header checksum status: Unverified]
    Source Address: 66.33.22.59
    Destination Address: 192.168.0.7
    [Stream index: 11]
Transmission Control Protocol, Src Port: 443, Dst Port: 51794, Seq: 26, Ack: 1, Len: 0
    Source Port: 443
    Destination Port: 51794
    [Stream index: 6]
    [Stream Packet Number: 6]
    [Conversation completeness: Incomplete (60)]
        ..1. .... = RST: Present
        ...1 .... = FIN: Present
        .... 1... = Data: Present
        .... .1.. = ACK: Present
        .... ..0. = SYN-ACK: Absent
        .... ...0 = SYN: Absent
        [Completeness Flags: RFDA··]
    [TCP Segment Len: 0]
    Sequence Number: 26    (relative sequence number)
    Sequence Number (raw): 562230824
    [Next Sequence Number: 27    (relative sequence number)]
    Acknowledgment Number: 1    (relative ack number)
    Acknowledgment number (raw): 871552180
    1000 .... = Header Length: 32 bytes (8)
    Flags: 0x011 (FIN, ACK)
        000. .... .... = Reserved: Not set
        ...0 .... .... = Accurate ECN: Not set
        .... 0... .... = Congestion Window Reduced: Not set
        .... .0.. .... = ECN-Echo: Not set
        .... ..0. .... = Urgent: Not set
        .... ...1 .... = Acknowledgment: Set
        .... .... 0... = Push: Not set
        .... .... .0.. = Reset: Not set
        .... .... ..0. = Syn: Not set
        .... .... ...1 = Fin: Set
            [Expert Info (Chat/Sequence): Connection finish (FIN)]
                [Connection finish (FIN)]
                [Severity level: Chat]
                [Group: Sequence]
        [TCP Flags: ·······A···F]
            [Expert Info (Note/Sequence): This frame initiates the connection closing]
                [This frame initiates the connection closing]
                [Severity level: Note]
                [Group: Sequence]
    Window: 501
    [Calculated window size: 501]
    [Window size scaling factor: -1 (unknown)]
    Checksum: 0xd552 [unverified]
    [Checksum Status: Unverified]
    Urgent Pointer: 0
    Options: (12 bytes), No-Operation (NOP), No-Operation (NOP), Timestamps
        TCP Option - No-Operation (NOP)
            Kind: No-Operation (1)
        TCP Option - No-Operation (NOP)
            Kind: No-Operation (1)
        TCP Option - Timestamps: TSval 845048784, TSecr 3634701109
            Kind: Time Stamp Option (8)
            Length: 10
            Timestamp value: 845048784
            Timestamp echo reply: 3634701109
    [Timestamps]
        [Time since first frame in this TCP stream: 29.736464000 seconds]
        [Time since previous frame in this TCP stream: 0.000001000 seconds]

No.     Time           Source                Destination           Protocol Length Info
  81435 32.931460      192.168.0.7           66.33.22.59           TCP      66     51794 → 443 [ACK] Seq=1 Ack=26 Win=2048 Len=0 TSval=3634715743 TSecr=845048784

Frame 81435: 66 bytes on wire (528 bits), 66 bytes captured (528 bits) on interface en0, id 0
    Section number: 1
    Interface id: 0 (en0)
        Interface name: en0
        Interface description: Wi-Fi
    Encapsulation type: Ethernet (1)
    Arrival Time: Sep 21, 2025 14:34:08.423156000 CST
    UTC Arrival Time: Sep 21, 2025 20:34:08.423156000 UTC
    Epoch Arrival Time: 1758486848.423156000
    [Time shift for this packet: 0.000000000 seconds]
    [Time delta from previous captured frame: 0.000081000 seconds]
    [Time delta from previous displayed frame: 0.000086000 seconds]
    [Time since reference or first frame: 32.931460000 seconds]
    Frame Number: 81435
    Frame Length: 66 bytes (528 bits)
    Capture Length: 66 bytes (528 bits)
    [Frame is marked: False]
    [Frame is ignored: False]
    [Protocols in frame: eth:ethertype:ip:tcp]
    [Coloring Rule Name: TCP]
    [Coloring Rule String: tcp]
Ethernet II, Src: 06:34:e6:94:64:f2 (06:34:e6:94:64:f2), Dst: Commscope_eb:d5:16 (c0:89:ab:eb:d5:16)
    Destination: Commscope_eb:d5:16 (c0:89:ab:eb:d5:16)
        .... ..0. .... .... .... .... = LG bit: Globally unique address (factory default)
        .... ...0 .... .... .... .... = IG bit: Individual address (unicast)
    Source: 06:34:e6:94:64:f2 (06:34:e6:94:64:f2)
        .... ..1. .... .... .... .... = LG bit: Locally administered address (this is NOT the factory default)
        .... ...0 .... .... .... .... = IG bit: Individual address (unicast)
    Type: IPv4 (0x0800)
    [Stream index: 0]
Internet Protocol Version 4, Src: 192.168.0.7, Dst: 66.33.22.59
    0100 .... = Version: 4
    .... 0101 = Header Length: 20 bytes (5)
    Differentiated Services Field: 0x00 (DSCP: CS0, ECN: Not-ECT)
        0000 00.. = Differentiated Services Codepoint: Default (0)
        .... ..00 = Explicit Congestion Notification: Not ECN-Capable Transport (0)
    Total Length: 52
    Identification: 0x0000 (0)
    010. .... = Flags: 0x2, Don't fragment
        0... .... = Reserved bit: Not set
        .1.. .... = Don't fragment: Set
        ..0. .... = More fragments: Not set
    ...0 0000 0000 0000 = Fragment Offset: 0
    Time to Live: 64
    Protocol: TCP (6)
    Header Checksum: 0x21b9 [validation disabled]
    [Header checksum status: Unverified]
    Source Address: 192.168.0.7
    Destination Address: 66.33.22.59
    [Stream index: 11]
Transmission Control Protocol, Src Port: 51794, Dst Port: 443, Seq: 1, Ack: 26, Len: 0
    Source Port: 51794
    Destination Port: 443
    [Stream index: 6]
    [Stream Packet Number: 7]
    [Conversation completeness: Incomplete (60)]
        ..1. .... = RST: Present
        ...1 .... = FIN: Present
        .... 1... = Data: Present
        .... .1.. = ACK: Present
        .... ..0. = SYN-ACK: Absent
        .... ...0 = SYN: Absent
        [Completeness Flags: RFDA··]
    [TCP Segment Len: 0]
    Sequence Number: 1    (relative sequence number)
    Sequence Number (raw): 871552180
    [Next Sequence Number: 1    (relative sequence number)]
    Acknowledgment Number: 26    (relative ack number)
    Acknowledgment number (raw): 562230824
    1000 .... = Header Length: 32 bytes (8)
    Flags: 0x010 (ACK)
        000. .... .... = Reserved: Not set
        ...0 .... .... = Accurate ECN: Not set
        .... 0... .... = Congestion Window Reduced: Not set
        .... .0.. .... = ECN-Echo: Not set
        .... ..0. .... = Urgent: Not set
        .... ...1 .... = Acknowledgment: Set
        .... .... 0... = Push: Not set
        .... .... .0.. = Reset: Not set
        .... .... ..0. = Syn: Not set
        .... .... ...0 = Fin: Not set
        [TCP Flags: ·······A····]
    Window: 2048
    [Calculated window size: 2048]
    [Window size scaling factor: -1 (unknown)]
    Checksum: 0x961e [unverified]
    [Checksum Status: Unverified]
    Urgent Pointer: 0
    Options: (12 bytes), No-Operation (NOP), No-Operation (NOP), Timestamps
        TCP Option - No-Operation (NOP)
            Kind: No-Operation (1)
        TCP Option - No-Operation (NOP)
            Kind: No-Operation (1)
        TCP Option - Timestamps: TSval 3634715743, TSecr 845048784
            Kind: Time Stamp Option (8)
            Length: 10
            Timestamp value: 3634715743
            Timestamp echo reply: 845048784
    [Timestamps]
        [Time since first frame in this TCP stream: 29.736550000 seconds]
        [Time since previous frame in this TCP stream: 0.000086000 seconds]
    [SEQ/ACK analysis]
        [This is an ACK to the segment in frame: 81429]
        [The RTT to ACK the segment was: 0.000087000 seconds]

No.     Time           Source                Destination           Protocol Length Info
  81436 32.931484      192.168.0.7           66.33.22.59           TCP      66     51794 → 443 [ACK] Seq=1 Ack=27 Win=2048 Len=0 TSval=3634715743 TSecr=845048784

Frame 81436: 66 bytes on wire (528 bits), 66 bytes captured (528 bits) on interface en0, id 0
    Section number: 1
    Interface id: 0 (en0)
        Interface name: en0
        Interface description: Wi-Fi
    Encapsulation type: Ethernet (1)
    Arrival Time: Sep 21, 2025 14:34:08.423180000 CST
    UTC Arrival Time: Sep 21, 2025 20:34:08.423180000 UTC
    Epoch Arrival Time: 1758486848.423180000
    [Time shift for this packet: 0.000000000 seconds]
    [Time delta from previous captured frame: 0.000024000 seconds]
    [Time delta from previous displayed frame: 0.000024000 seconds]
    [Time since reference or first frame: 32.931484000 seconds]
    Frame Number: 81436
    Frame Length: 66 bytes (528 bits)
    Capture Length: 66 bytes (528 bits)
    [Frame is marked: False]
    [Frame is ignored: False]
    [Protocols in frame: eth:ethertype:ip:tcp]
    [Coloring Rule Name: TCP]
    [Coloring Rule String: tcp]
Ethernet II, Src: 06:34:e6:94:64:f2 (06:34:e6:94:64:f2), Dst: Commscope_eb:d5:16 (c0:89:ab:eb:d5:16)
    Destination: Commscope_eb:d5:16 (c0:89:ab:eb:d5:16)
        .... ..0. .... .... .... .... = LG bit: Globally unique address (factory default)
        .... ...0 .... .... .... .... = IG bit: Individual address (unicast)
    Source: 06:34:e6:94:64:f2 (06:34:e6:94:64:f2)
        .... ..1. .... .... .... .... = LG bit: Locally administered address (this is NOT the factory default)
        .... ...0 .... .... .... .... = IG bit: Individual address (unicast)
    Type: IPv4 (0x0800)
    [Stream index: 0]
Internet Protocol Version 4, Src: 192.168.0.7, Dst: 66.33.22.59
    0100 .... = Version: 4
    .... 0101 = Header Length: 20 bytes (5)
    Differentiated Services Field: 0x00 (DSCP: CS0, ECN: Not-ECT)
        0000 00.. = Differentiated Services Codepoint: Default (0)
        .... ..00 = Explicit Congestion Notification: Not ECN-Capable Transport (0)
    Total Length: 52
    Identification: 0x0000 (0)
    010. .... = Flags: 0x2, Don't fragment
        0... .... = Reserved bit: Not set
        .1.. .... = Don't fragment: Set
        ..0. .... = More fragments: Not set
    ...0 0000 0000 0000 = Fragment Offset: 0
    Time to Live: 64
    Protocol: TCP (6)
    Header Checksum: 0x21b9 [validation disabled]
    [Header checksum status: Unverified]
    Source Address: 192.168.0.7
    Destination Address: 66.33.22.59
    [Stream index: 11]
Transmission Control Protocol, Src Port: 51794, Dst Port: 443, Seq: 1, Ack: 27, Len: 0
    Source Port: 51794
    Destination Port: 443
    [Stream index: 6]
    [Stream Packet Number: 8]
    [Conversation completeness: Incomplete (60)]
        ..1. .... = RST: Present
        ...1 .... = FIN: Present
        .... 1... = Data: Present
        .... .1.. = ACK: Present
        .... ..0. = SYN-ACK: Absent
        .... ...0 = SYN: Absent
        [Completeness Flags: RFDA··]
    [TCP Segment Len: 0]
    Sequence Number: 1    (relative sequence number)
    Sequence Number (raw): 871552180
    [Next Sequence Number: 1    (relative sequence number)]
    Acknowledgment Number: 27    (relative ack number)
    Acknowledgment number (raw): 562230825
    1000 .... = Header Length: 32 bytes (8)
    Flags: 0x010 (ACK)
        000. .... .... = Reserved: Not set
        ...0 .... .... = Accurate ECN: Not set
        .... 0... .... = Congestion Window Reduced: Not set
        .... .0.. .... = ECN-Echo: Not set
        .... ..0. .... = Urgent: Not set
        .... ...1 .... = Acknowledgment: Set
        .... .... 0... = Push: Not set
        .... .... .0.. = Reset: Not set
        .... .... ..0. = Syn: Not set
        .... .... ...0 = Fin: Not set
        [TCP Flags: ·······A····]
    Window: 2048
    [Calculated window size: 2048]
    [Window size scaling factor: -1 (unknown)]
    Checksum: 0x961d [unverified]
    [Checksum Status: Unverified]
    Urgent Pointer: 0
    Options: (12 bytes), No-Operation (NOP), No-Operation (NOP), Timestamps
        TCP Option - No-Operation (NOP)
            Kind: No-Operation (1)
